Source,Position,Faculty,Link,Description,PostingDate,DueDate
ASA,BioStatistician,Zimmerman Associates Inc,https://jobs.amstat.org/jobs/11547482/biostatistician,"ZAI has an immediate need for a Biostatistician in support of the NIH Library in Bethesda, Maryland. The Educational Services Branch provides support in developing and offering a broad array of training courses in topics such as systematic search, bibliometrics, and bioinformatics. The duties of the Biostatistician include offering basic statistics training, supporting the Library’s bioinformatics team and their services and customers, and providing consultations on the use of statistics within the Library. Primary responsibilities for this position will be to support data management and analysis activities. The position will entail training, advanced analysis of basic and complex datasets, data visualization, and report writing. Experience with SAS, Stata, and R programming is required to carry out analytical tasks.Candidates should be able to synthesize quantitative information from a variety of sources, juggle multiple tasks, and interact effectively with clients and colleagues. In addition, candidates should have experience delivering formal and informal training related to data analysis and interpretation. The ideal candidate will have experience with data management and analysis of data from multiple sites and in multiple formats.   Responsibilities: Perform advanced statistical analysis on a variety of datasets  Develop training sessions on basics statistics for NIH customers Create appropriate analysis documentation for dissemination to Library staff and customers. Provide consultation on statistical methods; formulating and solving problems utilizing statistics in the analyses of complex data sets; and serving as an expert on sampling, data weighting, and the utilization of multivariate parametric and non-parametric analyses Provide technical assistance to a variety of stakeholders to ensure a complete review of the issues that may arise in analysis. Prepare reports and presentations Provide deliverables in a timely manner Effectively communicate with client regarding issues, needs and/or priority setting for projects   Professional Skills: Solid knowledge of applying testing design principles for a variety of environments, including usability and accessibility testing Ability to quickly pick up new programming languages or adapt to new platforms Experienced systems thinker - ability to see how parts interact with the whole (big picture thinking) and can articulate to testing scenarios Strong analytical abilities, solid analytical and trouble-shooting skills, with the ability to quickly identify and resolve client issues Strong customer service orientation Team player with the ability to work in a fast-paced environment Ability to multi-task in a fast-paced environment Effective time management and prioritization practices Ability to work in a fast paced and demanding environment Excellent problem-solving skills with ability to analyze situations, identify existing or potential problems and recommend solutions Superior interpersonal skills including courtesy, professionalism, and a cooperative attitude  
								
								Qualifications: Master’s degree in statistics, bio-statistics, public health, economics or related field and 3-5 years of relevant experience.  Extensive experience in SAS, Stata, and R programming Extensive knowledge of Excel with expertise developing pivot tables, using Excel formulas, and using VBA in Excel 3-5 years’ experience working with and aggregating/merging multiple data streams 3-5 years’ experience of complex statistical analysis Minimum of 3 years of experience in health sciences Excellent verbal, interpersonal and written communication skills U.S. Citizenship 
						
		
			NOTES:
			
				2 openings.
		
	
							
								Internal Number: 1030 ZAI has been providing solutions and services to the Federal Government for more than four decades. From our start in 1977 to present day, we have continuously focused on exceeding our clients’ expectations. ZAI provides a broad array of services, with a focus on the effective management of information to enhance our customers’ ability to achieve their mission. From providing contact center services to clients and their customers, to managing records, libraries, information centers, and business process services and the IT systems used to support them, to complex support to the US Navy submarine Fleet, our focus on quality and customer service spans our entire portfolio of services.

We’re an innovative information management and engineering company with Federal civilian and defense contracting experience. Our achievement of ISO 9001:2008 certification in quality management, along with being assessed at CMMI Level 3 for systems development, are indicative of the quality service our staff provides.  

Our long-standing history of repeat business with organizations like FDA, DOJ, and the U.S. Navy stems from a track record of successful performance in providing the subject matter... expertise our clients require.

Whether you’re a records management professional looking for guidance on how to comply with NARA directives, or a Navy engineer spearheading a new submarine safety project, we can help. Our pool of more than 500 employees means you’ll always be matched with experienced, knowledgeable teams that possess the qualifications and security clearance levels necessary to work on projects of every scope and challenge.
			Show more
			Show less",2018-10-04,NA
ASA,"Faculty Position in Cancer Center Statistics- Rochester, MN",MAYO CLINIC,https://jobs.amstat.org/jobs/11547927/faculty-position-in-cancer-center-statistics-rochester-mn,"Heal the sick, advance the science, share the knowledge. MAYO CLINIC is a premier academic medical center with over 3,800 physicians and scientists in a unified multi-campus system. This unique environment brings together the best in patient care, groundbreaking research and innovative medical education. Mayo Clinic has been recognized as the best hospital in the nation for 2018-2019 by U.S. News and World Report. We are an integrated, multidisciplinary academic medical center with comprehensive programs in medical education and research that span across three group practice sites. We support a vibrant research enterprise and graduate school with a dedicated track in virology and gene therapy. In 2017, the institution received over $446 million in extramural research awards supplemented with over $304 million of institutional support. Mayo Clinic has a large number of outstanding laboratories and shared resources facilities, including a Viral Vector Production and preclinical Toxicology Core, Medical Genomics Facility, a Mouse Modeling Facility, Molecular and Microscopic Core Facilities, and unique Human Disease Tissue Banks. The Division of Biomedical Statistics and Informatics in the Department of Health Sciences Research at Mayo Clinic is seeking applications for a faculty position in the Section of Cancer Center Statistics.  The Section of Cancer Center Statistics, within the Division of Biomedical Statistics and Informatics, houses the Biostatistics Shared Resource of the Mayo Clinic Cancer Center and the Statistical and Data Center for the Alliance for Clinical Trials in Oncology. The Section has provided expert statistical collaboration with cancer investigators for over 35 years and has a rich tradition of methodological research in clinical trials, survival analysis, surrogate endpoints, quality of life methods, and high dimensional data. It currently houses 12 PhDs, 19 master’s Statisticians, and 27 bachelors-trained statisticians. Candidates should have a PhD in Biostatistics or a closely related field with demonstrated experience and interest in clinical trials and/or patient reported outcomes/quality of life methods. CLICK HERE  to apply online and learn more about Mayo Clinic Health System and the vast array of opportunities that await you. ©2018 Mayo Foundation for Medical Education and Research. Post offer/pre-employment drug screening is required. Mayo Clinic is an equal opportunity educator and employer (including veterans and persons with disabilities). Working at Mayo Clinic is making a difference. It's providing the highest quality patient care by placing the needs of patients first. At Mayo Clinic, you'll discover a culture of teamwork, professionalism and mutual respect — and most importantly, a life-changing career.",2018-10-04,NA
ASA,Statistician–Associate Research Professor/ Research Professor,"Arizona State University, College of Nursing and Health Innovation",https://jobs.amstat.org/jobs/11547440/statistician-associate-research-professor-research-professor,"Statistician–Associate Research Professor/Research Professor Arizona State University Phoenix, Arizona   The College of Nursing and Health Innovation (CONHI) at Arizona State University (ASU) has an exciting opportunity for a collaborating statistician at the Associate Research Professor or Research Professor level. The main responsibilities of this full-time, fiscal year position, as part of our interdisciplinary team of applied statisticians, are to partner with faculty on programmatic research and to teach courses in statistical methods, e.g., analysis of variance and linear regression models.   Specific duties include developing sample size estimates and data analysis plans for grant applications, conceiving, overseeing, and conducting analyses of existing datasets, participating in research dissemination through the development of publications and presentations, and serving on student thesis and dissertation committees.   Academic rank and salary are commensurate with professional academic statistical and teaching experience. This multi-year appointment can begin as soon as a suitable candidate is identified, but no later than Fall semester 2019, and is subject to review and renewal every 12 months.   CONHI is part of a vibrant research, education, and practice community at ASU, named this year by U.S. News and World Report for the third year in a row as #1 in Innovation among all universities in the US. Faculty at CONHI currently have numerous active grants funded by NIH, other federal agencies, and national foundations. CONHI faculty collaborate with a wide-ranging group of community and healthcare organizations, including Mayo Clinic, Phoenix Children’s Hospital, Banner Health, Dignity Health, HonorHealth, and the Veterans Administration Medical Center on research and practice initiatives to improve the economic, social, and cultural health and vitality of shared local, state, national, and global communities.   Competitive applications and their letters of interest will provide evidence related to the required and desired qualifications outlined below.     Required qualifications:   PhD in biostatistics, statistics, psychology, sociology, public health, or related fields. Documented evidence (e.g., published research, professional presentations, grant applications, teaching evaluations, etc.) of strong analytic and quantitative skills, a record of research dissemination, and effective communication skills. Demonstrated mentoring and teaching ability in statistics and research methods. Evidence of advanced skills and experience in use of SPSS and SAS.    Desired qualifications:    Experience working with faculty and graduate students in interdisciplinary teams, especially those studying health-related behaviors, health outcomes, healthcare, and/or healthcare policy. Experience with development, implementation, and evaluation of grant applications to be submitted to NIH, NSF, or other major grant-making organizations (e.g., Robert Wood Johnson Foundation, American Heart Association). Experience in devising and executing sophisticated data analysis plans involving (1) generalized linear mixed models and generalized estimating equations, (2) randomized clinical trials, (3) long-term and intensive longitudinal design, (4) data from complex sampling designs, and (5) health services research and cost analyses. Experience and skills in using other statistical software (e.g., Mplus, R, Stata) and/or relational database software are also desirable. Initial close date for the position is October 31, 2018 at 5:00 pm MST; applications will be reviewed monthly thereafter until the search is closed.  Early applications are encouraged.  A criminal and employment history background check will be performed prior to the employment offer.    Applicants are asked to email (preferred) the following information to Angelica Jaszewski at Angelica.Jaszewski@asu.edu with the subject line of “CONHI Research Associate Professor Position Job # 12563”   Apply with a letter of interest, addressing required and desired qualifications. Curriculum Vitae Names and contact information (title, position, e-mail, phone number) of three references.   Or   Angelica Jaszewski College of Nursing and Health Innovation ASU Downtown Phoenix Campus 500 N. 3rd Street Phoenix, AZ 85004-0698 Angelica.Jaszewski@asu.edu    Applicants for academic positions at Arizona State University are encouraged to take the opportunity to complete the voluntary EEO Survey.   A criminal and employment history background check will be performed prior to an employment offer. For more information about Arizona State University and the College of Nursing and Health Innovation, you are invited to visit: http://nursingandhealth.asu.edu/   Arizona State University is an equal opportunity/affirmative action employer. Women and minorities are encouraged to apply. See ASU’s full non-discrimination statement (ACD 401) at: https://www.asu.edu/aad/manuals/acd/acd401.html and the Title IX statement at: https://www.asu.edu/titleIX/  
								
								Required qualifications:   PhD in biostatistics, statistics, psychology, sociology, public health, or related fields. Documented evidence (e.g., published research, professional presentations, grant applications, teaching evaluations, etc.) of strong analytic and quantitative skills, a record of research dissemination, and effective communication skills. Demonstrated mentoring and teaching ability in statistics and research methods. Evidence of advanced skills and experience in use of SPSS and SAS.   
						
							
								Internal Number: Job# 12563 The College of Nursing & Health lnnovation at Arizona State University is an inclusive world-class enterprise of discovery that prepares innovative, evidence-based healthcare providers, educators, leaders and researchers to optimize health in a culturally diverse global community.",2018-10-04,NA
ASA,Assistant Professor,Colorado State University,https://jobs.amstat.org/jobs/11547406/assistant-professor,"The Department of Psychology at Colorado State University invites applications for a tenure-track faculty position at the rank of Assistant Professor in INDUSTRIAL AND ORGANIZATIONAL (IO) PSYCHOLOGY with an appointment date of August 16, 2019. Priority will be given to candidates with research expertise in Data Science and IO. Data Science is considered a multidisciplinary/interdisciplinary field that connects business, statistics, computer science and/or software programming, behavioral sciences, and communication. Although the specific research focus is open, a primary research program that uses modern “Big Data” methods for data collection and analysis (e.g., machine learning algorithms, data mining, predictive modeling, statistical modeling, learning analytics) with naturally occurring data sets applied to IO is highly desirable. Candidates should be able to teach undergraduate and graduate level coursework in IO psychology, and specialty courses related to their area of research interest in data science or applications of data science to IO. Required qualifications: Ph.D., or anticipated Ph.D. completion by 07/30/2019 in Psychology or related discipline. Individuals with an equivalent degree in a closely related area to Psychology, IO, and/or Data Science will be considered with evidence of IO related research and ability to teach graduate and undergraduate courses in psychology. Preferred qualifications: Priority may be given to candidates with one or more of the following preferred qualifications: (1) Active research program related to Data Science and/or IO. Our emphasis is on a data scientist with an IO background, to teach, mentor students, and conduct research that is relevant to IO psychology. Candidates with a clear and consistent record of publication in Data Science relevant to IO psychology will be preferred over candidates whose publication records are primarily outside of Data Science and/or IO, but who have a few data science-related or IO publications. (2) Ability to collaborate with and develop partnerships across campus with colleagues in other data science-related fields; (3) have experience in undergraduate and/or graduate instruction and mentoring; (4) demonstrate ongoing commitment to and the capability of obtaining external research funding; and (5) show a continuous commitment to diversity, inclusion, and social justice (see special instructions below). Although the specific area of research interest within data science and IO is open, successful candidates will be expected to be able to (6) teach core curricular classes within the Department of Psychology, including Industrial and/or Organizational psychology and Data Science; (7) teach advanced quantitative methods and/or methods in Data Science for psychology graduate students; (8) provide evidence of teaching graduate and undergraduate courses in industrial psychology; and (9) teach psychological measurement, methods, and advanced statistical analyses such as SEM and longitudinal analyses. To ensure full consideration, complete applications must be received by 11:59PM (Mountain Time) on November 2, 2018, but applications will be accepted until the position is filled. Apply on-line at http://jobs.colostate.edu/postings/60567.  Please note that a complete application consists of a cover letter, curriculum vitae, relevant preprints/reprints of publications, research statement, teaching statement and evidence of teaching effectiveness, and three letters of reference. Referees will be sent an email requesting a letter of reference immediately upon submission of your application. Please inform your referees that letters should be submitted by November 9, 2018 to ensure full consideration. Special instructions: Under “other” please upload a personal statement on your contribution and commitment to diversity and inclusion, which will help us identify candidates who have the professional skills, experience, and/or willingness to engage in activities that advance our campus diversity and equity goals. Contributions can take a variety of forms including interest in or efforts to advance equitable access to education and research, or public service that addresses the needs of a diverse population. Application materials of semifinalist candidates, including letters of reference, will be made available for review by the entire faculty of the Department of Psychology. Information about jobs in the Department of Psychology at Colorado State University can be obtained at http://psychology.colostate.edu/jobs-in-psychology-at-CSU/  CSU is an EO/EA/AA employer, and is committed to providing a safe and productive learning and living community. To support this environment and comply with applicable laws and regulations, CSU conducts background checks on all final candidates.  
								
								 
						
		
			NOTES:
			
				Employer will assist with relocation costs. The Department of Psychology resides in CSU’s College of Natural Sciences, along with seven other departments: Biochemistry and Molecular Biology, Biology, Chemistry, Computer Science, Mathematics, Physics, and Statistics. The Psychology Department serves approximately 1000 undergraduate majors and 100 graduate students, with roughly 30 full-time faculty members distributed across five doctoral programs: (1) Applied Social and Health Psychology, (2) Cognitive Neuroscience, (3) Cognitive Psychology, (4) Counseling Psychology, and (5) Industrial and Organizational Psychology. The Department houses several service centers including the Psychological Services Center, supporting graduate training objectives in counseling psychology while serving the CSU population’s mental health needs; the Center for Meaning and Purpose, which focuses on acquiring, creating, and disseminating knowledge about enabling meaning, well-being, and positive health; and the Aging Clinic of the Rockies, which focuses on research, clinical services, and outreach for older adults in the community. The Department boasts two research centers: the Tri-Ethnic Center, which conducts research on social problems that af...fects rural and ethnic populations, and the Colorado Injury Control Research Center, which conducts research and provides service and education on injury prevention.
The Department is primarily located in the Behavioral Sciences Building (BSB), a LEED Gold Certified building completed in 2010. The BSB includes modern office space for all full-time faculty and graduate students, meeting and seminar rooms, state-of-the-art classrooms, and numerous lounge and study areas. In total, the Department controls over 100,000 square feet of research, teaching, and office space. More information on the Department can be obtained at: http://psychology.colostate.edu
			Show more
			Show less",2018-10-04,2019-08-16
ASA,PhD Statistician,RAND Corporation,https://jobs.amstat.org/jobs/11547629/phd-statistician,"Statisticians at RAND work across all RAND research areas, including health policy, labor and population, education and training, criminal and civil justice, national security, aging, and military manpower. These projects often pose novel challenges in design, sampling, measurement, analysis, modeling, imputation, and computing. Statisticians also have the opportunity to perform research in statistical methods, lead research projects, and provide statistical consulting and education to the RAND research community. More information about statisticians at RAND is available at http://www.rand.org/statistics/ Qualifications  Candidates should have strong theoretical training, a genuine interest in applied statistics, and excellent oral and written communication skills. All research positions at RAND require excellent analytic skills; the ability to communicate clearly and effectively in English, both orally and in writing; the ability to work effectively as a member of a multidisciplinary team; and a strong commitment to RAND's core values of quality and objectivity. We seek both recent graduates and experienced statisticians with substantial publication records and extensive applied experience. Senior research positions require demonstrated ability to mentor and develop junior staff members, lead and direct multidisciplinary teams, set project standards and monitor progress, handle significant budget responsibilities, and communicate interim and final results to the RAND community and to policymaking audiences. Education Requirements  PhD in statistics or biostatistics (you may also apply if you are at the dissertation stage and expect to complete your PhD within 12 months) Excellent theoretical training and empirical skills, including experiment design, sampling, and modeling Location  Santa Monica, CA; Pittsburgh, PA; Boston, MA; Washington, DC Special Note  Please submit a cover letter, CV, statement of research interests and consulting experience, and writing sample online as pdf documents. In addition, graduate transcripts (if degree received after 2015) and three letters of recommendation should be sent to statrecruiting@rand.org . Review of applications will begin in mid-October; complete applications received by December 16, 2018, will receive priority consideration. RAND is an Equal Opportunity Employer Minorities/Females/Vets/Disabled  
								
								 
						
							
								Internal Number: 5436 The RAND Corporation is a research organization that develops solutions to public policy challenges to help make communities throughout the world safer and more secure, healthier and more prosperous. RAND’s research and analysis address issues that impact people everywhere, including security, health, education, sustainability, growth, and development. Headquartered in Santa Monica, California, RAND has approximately 1,850 people from more than 50 countries working in offices in North America, Europe and Australia, with annual revenues of more than $315 million.

RAND is nonprofit, nonpartisan, and committed to the public interest.  Our research is sponsored by government agencies, foundations, other nonprofit organizations, and the private sector. We rely on philanthropic support to reach beyond the scope of client-sponsored work to tackle questions that may be too big, too complex, or too new for our clients to address. RAND values objectivity and integrity in both its research processes and internal interactions. We emphasize a collegial environment that respects the contributions and dignity of all staff.",2018-10-04,NA
