Source,Position,Faculty,Link,Description,PostingDate,DueDate
ASA,Assistant Professor of Statistics /  Data Science,UNIVERSITY OF NEW HAMPSHIRE,https://jobs.amstat.org/jobs/11518668/assistant-professor-of-statistics-data-science,"The Department of Mathematics and Statistics invites applications for a tenure-track faculty position in statistics / data science / applied mathematics at the assistant professor level, starting in the fall semester of 2019. The department offers undergraduate and graduate programs in statistics, applied mathematics, mathematics education, and pure mathematics. The department is housed in the College of Engineering and Physical Sciences. The college has a thriving statistics program and a new interdisciplinary B.S. degree in analytics and data science, with faculty from statistics, applied mathematics, and computer science. In addition, the college is currently developing M.S. and Ph.D. programs in data science. Qualifications: The successful candidate will have an earned doctorate in statistics or a closely related discipline. We seek applicants who have demonstrated the ability to teach a variety of statistics courses, in particular applied and computational statistics and/or data science related courses. Preference will be given to applicants with significant research experience closely related to emerging areas of data science, such as large data analysis, high-dimensional statistical modeling, predictive learning, numerical and computational methods, statistical and computational genomics. Applicants are expected to be committed to interdisciplinary research in the general area of data science and to have a strong computational component in their research. It is expected that the new hire will contribute substantially to the college's effort in data science program development and seek collaborations with members of the emerging community of data science faculty members from statistics, applied mathematics, computer science and analytics. Responsibilities: The responsibilities of the position include (1) teaching undergraduate and graduate statistics courses for majors and non-majors (2) developing new courses in the intersection of statistics and data science or related areas (3) advising undergraduate and graduate students, (4) developing a successful research program that includes collaborative work with colleagues and graduate students and active pursuit of external funding to support research activities, and (5) providing service to the department, college, university and profession. The University of New Hampshire (UNH) is a major research institution, providing comprehensive, high-quality undergraduate programs and graduate programs of distinction. The University actively promotes a dynamic learning environment in which qualified individuals of differing perspectives, life experiences, and cultural backgrounds pursue academic goals with mutual respect and shared inquiry. UNH is the primary university of the University System of New Hampshire. It has approximately 16000 students and is situated in the beautiful seacoast area of southern New Hampshire, in close proximity to the ocean and the White Mountains, and only 60 miles from Boston with convenient bus and train service. UNH is an Equal Opportunity / Equal Access / Affirmative Action institution. The University seeks excellence through diversity among its administrators, faculty, staff, and students. The university prohibits discrimination on the basis of race, color, religion, sex, age, national origin, sexual orientation, gender identity or expression, disability, veteran status, or marital status. Application by members of all underrepresented groups is encouraged. Applications should be submitted through http://jobs.usnh.edu/postings/30856 and should include a cover letter, a resume/vita, a research statement, a teaching statement, and three professional letters of references, at least one of which addresses teaching experience. Reference letters must be submitted directly by the referees. Review of applications will begin immediately and will continue until the position is filled.   PI104522382 ",2018-09-26,NA
ASA,"One or more tenure track positions;one assistant professor,other open rank subject to qualifications",North Carolina State University,https://jobs.amstat.org/jobs/11518672/one-or-more-tenure-track-positions-one-assistant-professor-other-open-rank-subject-to-qualifications,"North Carolina State University (NC State) invites applications for one or more tenure-track faculty positions in the Edward P. Fitts Department of Industrial and Systems Engineering (ISE). One position is at the assistant professor level, although applicants with proper qualifications may be considered for appointment at other ranks. Candidates are expected to have a PhD degree in Industrial Engineering, Operations Research, Computer Science, Statistics, or a related field. Applications will be considered in any area related to ISE. We are especially seeking applicants with expertise in (i) data science and analytics (including application of domain knowledge for “big data” problems as well as a methodology focus from optimization, statistics, or similar areas) or in (ii) production, logistics, or supply chain systems but will consider other areas. The expected start date for this position is Fall 2019. Salary will be competitive based on qualifications. The Edward P. Fitts Department of Industrial and Systems Engineering (www.ise.ncsu.edu) is one of only five named industrial and systems engineering departments in the United States and is consistently ranked among the top programs in the country. The department currently has a rich and diverse research portfolio in advanced manufacturing, biomedical manufacturing, health systems, human-systems, logistics, production systems, and systems analysis and optimization.The department houses two state funded centers, including: The Ergonomics Center of North Carolina (www.theergonomicscenter.com), which is the only center of its kind at a U.S. public research institution, and the Center for Additive Manufacturing and Logistics (camal.ncsu.edu), which is one of the most advanced manufacturing and 3D printing laboratories in the country. These centers are supported by world-class laboratory facilities for computing, manufacturing, and human-systems research. The department also supports two other academic programs within the university, including Operations Research (www.or.ncsu.edu) and Integrated Manufacturing Systems Engineering (www.imsei.ncsu.edu), and the department has a rich set of connections with other departments, other universities, medical schools, and other external partners.    
								
								Teaching responsibilities will include graduate and undergraduate instruction as well as supervision of student research at the Masters and the Doctoral levels. Applicants will be expected to develop a sponsored research program. General research responsibilities for faculty include a commitment to original and independent work and pursuing interdisciplinary collaborations, both within and external to NC State. Our location in Raleigh, NC, represents the eastern point of the Research Triangle and places us close to three major universities, a large number of world-class companies, and several leading research institutes. Inclusiveness and diversity are integral to NC State’s commitment to excellence in research, engagement, and education. We are particularly interested in candidates who have demonstrated experience engaging with diversity through activities such as fostering an inclusive environment, working with students from diverse backgrounds, or incorporating diverse perspectives in research. Please submit a cover letter, CV, research and teaching statements, and the names and contact information for three (3) professional references online at https://jobs.ncsu.edu/postings/106248. You may also include a statement detailing how your teaching, service and/or scholarship has supported the success of students from racial, ethnic, and gender backgrounds that are underrepresented in the academic field; applicants who have not yet had the opportunity for such experience should note how their work will further NC State’s commitment to diversity and its mission as a land grant university. Review of applications will begin on October 1, 2018, and will continue until the position(s) is filled. NC State University is an equal opportunity and affirmative action employer. All qualified applicants will receive consideration for employment without regard to race, color, national origin, religion, sex, gender identity, age, sexual orientation, genetic information, status as an individual with a disability, or status as a protected veteran.  Individuals with disabilities requiring disability-related accommodations in the application and interview process, please call 919-515-3148.  Final candidates are subject to criminal & sex offender background checks. Some vacancies also require credit or motor vehicle checks. If highest degree is from an institution outside of the U.S., final candidates are required to have their degree verified at www.wes.org. Degree must be obtained prior to start date. NC State University participates in E-Verify. Federal law requires all employers to verify the identity and employment eligibility of all persons hired to work in the United States. ",2018-09-26,2018-10-01
ASA,Assistant Professor in Applied Statistics,New College of Florida,https://jobs.amstat.org/jobs/11518679/assistant-professor-in-applied-statistics,"New College of Florida invites applications for a tenure-track Assistant Professor position in Applied Statistics, starting in August, 2019. A Ph.D. in Statistics or a closely related field by the start date is required.  We seek an individual to contribute to an innovative data science program in a liberal arts context.  Candidates must be passionate about designing and teaching courses and guiding research at both the master’s and undergraduate level in a highly interdisciplinary setting. In addition to teaching, the successful applicant will be capable of establishing a productive research program.   The teaching load is two classes per semester, plus supervision of tutorials, independent study projects, senior theses and master's level projects. The College is especially interested in candidates who wish to contribute to the diversity and excellence of the academic community through teaching, scholarship and service.  Candidates from underrepresented groups, women, and those whose knowledge or skills support an inclusive culture and learning environment are especially encouraged to apply. Situated on the Gulf Coast of Florida and Sarasota Bay, New College is a nationally recognized, selective public honors college with a 10:1 student/faculty ratio. Students are intellectually independent and highly motivated. Undergraduate research has a central role in the curriculum, and a senior thesis/project is required of all students. Students receive narrative evaluations in lieu of grades. New College is committed to excellence in teaching and research and encourages collaborative student-faculty scholarship.  www.ncf.edu.  A complete application includes a letter of application, curriculum vitae, three letters of recommendation (at least one that addresses teaching), a statement of teaching philosophy (including course proposals), a description of proposed research (including how undergraduates could be involved) and a statement regarding the candidate’s contributions or approaches to supporting an inclusive culture and learning environment.  We will begin reviewing materials on November 9, but applications will be considered until the position is filled. New College of Florida is an EOE institution. Please complete the application at ncf.simplehire.com. Contact jobs@ncf.edu with any questions.    
								
								A complete application includes a letter of application, curriculum vitae, three letters of recommendation (at least one that addresses teaching), a statement of teaching philosophy (including course proposals), a description of proposed research (including how undergraduates could be involved) and a statement regarding the candidate’s contributions or approaches to supporting an inclusive culture and learning environment.  We will begin reviewing materials on November 9, but applications will be considered until the position is filled. New College of Florida is an EOE institution. Please complete the application at ncf.simplehire.com. Contact jobs@ncf.edu with any questions. New College of Florida is a national leader in the arts and sciences and is the State of Florida's designated honors college for the liberal arts. Consistently ranked among the top public liberal arts colleges in America by U.S. News & World Report, Forbes and The Princeton Review, New College attracts highly motivated, academically talented students from 38 states and 20 foreign countries.",2018-09-26,2019-08-20
ASA,Quantitative Associate Program 2019,Wells Fargo,https://jobs.amstat.org/jobs/11513984/quantitative-associate-program-2019,"Wells Fargo is inviting applications for its Quantitative Associate program. It provides the opportunity to gain comprehensive professional and industry experience and prepares Associates to develop, implement, calibrate, validate or audit various analytical models. Each successful hire will participate in a ok, sounds good. 12-month rotational program, followed by permanent placement.   Our Credit & Operational Risk track is open to graduating PhDs and Masters candidates and provides Associates the opportunity to work with various lines of business to develop, validate, implement and calibrate statistical and econometric models for loss forecasting, credit risk scorecard, risk segmentation and stress testing for a variety of lending products and operational risk processes.      
								
								Qualifications:  PhD or Master’s degree in Statistics, Economics, Computer Science, Quantitative Finance, Operations Research, Applied or Computational Mathematics, or a related quantitative field Candidates should have an expected graduation between December 2018 and June 2019 (all requirements including thesis defense completed by June 2019) Experience in data analytics, modeling, statistical inference, computing, big data and machine learning Excellent computer programing skills in C++/Python/R/SAS/SQL Excellent written/oral communication skills 
						
		
			NOTES:
			
				30 openings.Employer will assist with relocation costs. Wells Fargo & Company (NYSE: WFC) is a diversified, community-based financial services company with $2.0 trillion in assets. Wells Fargo’s vision is to satisfy our customers’ financial needs and help them succeed financially. Founded in 1852 and headquartered in San Francisco, Wells Fargo provides banking, investments, mortgage, and consumer and commercial finance through more than 8,300 locations, 13,000 ATMs, the internet (wellsfargo.com) and mobile banking, and has offices in 42 countries and territories to support customers who conduct business in the global economy. With approximately 263,000 team members, Wells Fargo serves one in three households in the United States. Wells Fargo & Company was ranked No. 25 on Fortune’s 2017 rankings of America’s largest corporations. News, insights and perspectives from Wells Fargo are also available at Wells Fargo Stories: https://stories.wf.com.",2018-09-25,2019-06-20
ASA,Assistant/ Associate/ Professor,84112,https://jobs.amstat.org/jobs/11514525/assistant-associate-professor,"Biophysics Cluster, University of Utah. The proposed position is part of a cluster that comprises multiple tenure-track faculty positions, and is designed to establish excellence in emerging interdisciplinary fields; departmental appointments may be in Physics, Biology, Chemistry or Mathematics. A major goal is to strengthen both applied biophysics, as well as the field of molecular modeling of biophysical processes. All candidates are expected to demonstrate the ability to develop a vigorous, competitive and well-funded research program and will be evaluated on how their research potentially contributes to the long-term goal of excellence in interdisciplinary bridge areas. Applications by investigators, both experimentalists and theorists/modelers, interested in investigating biomacromolecular interactions are particularly encouraged. Faculty hired are expected to participate in the development and teaching of innovative courses related to this initiative. While the openings are at the Assistant Professor level, exceptional senior candidates will be considered. For full consideration, applications should be received by November 15, 2018. Assistant Professor applicants should upload an application letter with vita, a description of proposed research, and arrange for three letters of recommendation to be sent on their behalf. Senior applicants should upload an application letter and CV.  Applications should be uploaded in PDF format to http://utah.peopleadmin.com/postings/82979.  Initial interview selections will begin as applications are received, but applications submitted at a later date will be considered as needed.  EEO/Diversity Information The University of Utah is an Affirmative Action/Equal Opportunity employer and does not discriminate based upon race, national origin, color, religion, sex, age, sexual orientation, gender identity/expression, status as a person with a disability, genetic information, or Protected Veteran status. Individuals from historically underrepresented groups, such as minorities, women, qualified persons with disabilities and protected veterans are encouraged to apply. Veterans’ preference is extended to qualified applicants, upon request and consistent with University policy and Utah state law. Upon request, reasonable accommodations in the application process will be provided to individuals with disabilities. To inquire about the University’s nondiscrimination or affirmative action policies or to request disability accommodation, please contact: Director, Office of Equal Opportunity and Affirmative Action, 201 S. Presidents Circle, Rm 135, (801) 581-8365.The University of Utah values candidates who have experience working in settings with students from diverse backgrounds, and possess a strong commitment to improving access to higher education for historically underrepresented students.    
								
								 
						
		
			NOTES:
			
				2 openings.
		
	
							
								Internal Number: PRN00329CF As a preeminent research and teaching university with national and global reach, the University of Utah provides a wide range of opportunities for personal and professional growth in educational, research, and clinical environments.",2018-09-25,2018-11-15
ASA,Tenure-track Faculty Positions in Biostatistics,Yale School of Public Health,https://jobs.amstat.org/jobs/11514528/tenure-track-faculty-positions-in-biostatistics,"The Department of Biostatistics in the School of Public Health at Yale University is seeking applicants at the rank of Assistant Professor. Recent graduates and applicants with a research focus in any area of biostatistics are encouraged to apply, such as big data, causal inference, genomics, environmental statistics, clinical trials, missing data, imaging, data mining, Bayesian methods, etc. The Yale School of Public Health is committed to growing and extending its expertise in biostatistics. There are existing collaborations with the School of Medicine, particularly with the Yale Center for Clinical Investigation (Yale CTSA) and Cancer Center, and throughout the university. Successful candidates will be expected to develop an independent program of methodological research in their area of interest, while cultivating collaborations with other investigators in the School of Public Health, the School of Medicine and the University. In addition, successful candidates will be expected to teach graduate courses. Review of applications will commence on November 1, 2018 and will continue until a successful candidate is identified.  
								
								Applicants should have a PhD by the start of appointment in statistics, biostatistics, or a closely related field. Applicants are asked to prepare PDF files that contain a cover letter, curriculum vitae, statement of research and teaching interests, copies of up to five recent publications and contact information for three references. Please apply online at:   http://apply.interfolio.com/54976   For additional information and inquiries please contact: Biostatistics Search Committee Chair Email correspondence: biostatistics.search@yale.edu www.yale.edu/ysph   Yale is an Affirmative Action/Equal Opportunity employer. Yale values diversity in its faculty, students, and staff and especially welcomes applications from women, persons with disabilities, protected veterans, and underrepresented minorities. ",2018-09-25,2018-11-01
ASA,Mathematics or Statistics Education Asst/ Assoc/ Full Professor,Michigan State University,https://jobs.amstat.org/jobs/11510525/mathematics-or-statistics-education-asst-assoc-full-professor,"Michigan State University invites applications from outstanding candidates for an open rank tenure system faculty position focusing on post-secondary Mathematics or Statistics Education. Michigan State University provides an exceptional environment for mathematics educators, with a world-renowned faculty who lead the top-ranked doctoral program in Mathematics Education, highly regarded Departments of Mathematics, Statistics and Probability, and Computational Mathematics, Science and Engineering, as well as the Program in Mathematics Education (PRIME), and the CREATE for STEM Institute. Current initiatives in these programs include the Department of Mathematics Center for Instructional Mentoring (https://math.msu.edu/cim/) and curriculum development in quantitative literacy, College Algebra and Calculus. More information about active research programs can be found at https://prime.natsci.msu.edu/research-projects/, as well as by following links at the above department/unit home pages.  
								
								The position requires an earned doctorate in Mathematics Education, Mathematics, Statistics, or a related field, a research program in Mathematics Education or Statistics Education, and, if the doctorate is not in Mathematics or Statistics, a master’s degree or higher in Mathematics or Statistics. The successful candidate at the senior level will have an internationally influential and externally supported research program in Mathematics Education or Statistics Education, demonstrated excellence in teaching, and a sustained history of mentoring. At the junior level, evidence of excellence in teaching and a burgeoning research program in Mathematics Education or Statistics Education are required, and some mentorship experience is desired. The successful candidate at either level will be expected to maintain an active research program, to assume leadership roles, and to engage in campus-wide initiatives to improve the teaching and learning of mathematics and/or statistics at the undergraduate level. Michigan State University has been advancing the common good with uncommon will for more than 160 years. A member of the Association of American Universities, MSU is a research-intensive institution with 17 degree-granting colleges.

MSU is an affirmative-action, equal-opportunity employer and is committed to achieving excellence through a diverse workforce and inclusive culture that encourages all people to reach their full potential. The University actively encourages applications and/or nominations of women, persons of color, veterans and persons with disabilities.  MSU is committed to providing a work environment that supports employees’ work and personal life, and offers employment assistance to the spouse or partner of candidates for faculty and academic staff positions.",2018-09-25,NA
