Source,Position,Faculty,Link,Description,PostingDate,DueDate
ASA,Assistant/ Associate/ Professor,84112,https://jobs.amstat.org/jobs/11447029/assistant-associate-professor,"Neuroscience/Chemical Biology Cluster, University of Utah. The proposed position is part of a cluster that comprises multiple tenure-track faculty positions, and is designed to establish excellence in emerging interdisciplinary fields; departmental appointments may be in Physics, Biology, Chemistry, Mathematics or Biochemistry. A major goal is to strengthen Cellular and Molecular Neuroscience , as well as to link Neuroscience to the Chemical Biology of Natural Products. All candidates are expected to demonstrate the ability to develop a vigorous, competitive and well-funded research program and will be evaluated on how their research potentially contributes to the long-term goal of excellence in interdisciplinary bridge areas. Applications by investigators, both experimental and theoretical, interested in macromolecular complexes on the membranes of neurons are particularly encouraged. An undergraduate track in Neuroscience and Biophysics is being developed within the College of Science, and faculty hired through this cluster are expected to participate in the development and teaching of innovative courses related to this initiative. While the openings are at the Assistant Professor level, exceptional senior candidates will be considered.  For full consideration, applications should be received by October 31, 2018.   Assistant Professor applicants should upload an application letter with vita, a description of proposed research, and arrange for three letters of recommendation to be sent on their behalf.   Senior applicants should upload an application letter and CV.  Applications should be uploaded in PDF format to http://utah.peopleadmin.com/postings/81886.  Initial interview selections will begin as applications are received, but applications submitted at a later date will be considered as needed.   EEO/Diversity Information The University of Utah is an Affirmative Action/Equal Opportunity employer and does not discriminate based upon race, national origin, color, religion, sex, age, sexual orientation, gender identity/expression, status as a person with a disability, genetic information, or Protected Veteran status. Individuals from historically underrepresented groups, such as minorities, women, qualified persons with disabilities and protected veterans are encouraged to apply. Veterans’ preference is extended to qualified applicants, upon request and consistent with University policy and Utah state law. Upon request, reasonable accommodations in the application process will be provided to individuals with disabilities. To inquire about the University’s nondiscrimination or affirmative action policies or to request disability accommodation, please contact: Director, Office of Equal Opportunity and Affirmative Action, 201 S. Presidents Circle, Rm 135, (801) 581-8365.The University of Utah values candidates who have experience working in settings with students from diverse backgrounds, and possess a strong commitment to improving access to higher education for historically underrepresented students.  
								
								 
						
		
			NOTES:
			
				2 openings.
		
	
							
								Internal Number: PRN00309CF As a preeminent research and teaching university with national and global reach, the University of Utah provides a wide range of opportunities for personal and professional growth in educational, research, and clinical environments.",2018-09-05,2018-10-31
ASA,"Assistant Professor, Statistics",University of Central Florida,https://jobs.amstat.org/jobs/11434748/assistant-professor-statistics,"The Department of Statistics at the University of Central Florida (UCF) seeks to hire two nine-­month, tenure-track assistant professors of statistics anticipated to begin in August 2019. The successful candidates will contribute to teaching in the undergraduate and graduate programs and are expected to develop an externally funded, nationally competitive research program in big data analytics. A competitive startup package is available. The Department of Statistics at UCF currently offers a B.S. in Statistics, a B.S. in Actuarial Science, an M.S. in Statistical Computing, with a track in Data Mining, and a Ph.D. in Big Data Analytics. The University of Central Florida, the nation’s second-largest university with more than 67,000 students, has grown in size, quality, diversity, and reputation in its first 50 years. Today, the university offers more than 200 degree programs at its main campus in Orlando and more than a dozen other locations. UCF is an economic engine attracting and supporting industries vital to the region’s future while providing students with real-world experience that helps them succeed after graduation. For more information about UCF, visit http://ucf.edu. For more information about the Department of Statistics, contact the department at 407-823-5562 or visit the department’s website at http://sciences.ucf.edu/statistics/. Applicants who apply for this position will also be considered for position number 30272. As an equal opportunity/affirmative action employer, UCF encourages all qualified applicants to apply, including women, veterans, individuals with disabilities, and members of traditionally underrepresented populations. UCF's Equal Opportunity Statement can be viewed at: http://www.oie.ucf.edu/documents/PresidentsStatement.pdf. As a Florida public university, UCF makes all application materials and selection procedures available to the public upon request. UCF requires all applications and supporting documents to be submitted electronically through the Human Resources website, www.jobswithucf.com. In addition to the online application, interested candidates should upload the following: a letter of interest, a statement of teaching philosophy, a statement of research interests, a curriculum vitae (CV), graduate transcripts, and a list of three professional references with their contact information. Arrange to have three letters of professional reference sent to Professor David Nickerson at David.Nickerson@ucf.edu. Note: Please have all documents ready when applying so they can be attached at that time. Once the online submission process is finalized, the system does not allow applicants to submit additional documents at a later date. For questions about the position, please contact Dr. David Nickerson, search committee chair, at David.Nickerson@ucf.edu. Review of applications will begin December 3, 2018 and continue until the position is filled.  
								
								A Ph.D. in statistics or a closely related field from a regionally accredited institution by the start of appointment is required. All but dissertation (ABD) will be considered as long as the doctorate is completed by the date of hire. Preference will be given to those with teaching experience in data mining and big data analytics, statistical machine learning, or a willingness to teach courses in these areas. 
						
		
			NOTES:
			
				2 openings. Department of Statistics, University of Central Florida",2018-09-04,2019-08-20
ASA,"Assistant Professor, Cognitive & Statistical Sciences","Unviersity of Toronto, Department of Statistical Sciences",https://jobs.amstat.org/jobs/11430386/assistant-professor-cognitive-statistical-sciences,"The Department of Psychology and the Department of Statistical Sciences in the Faculty of Arts and Science at the University of Toronto invites applications for a joint (67% Statistical Sciences, 33% Psychology) tenure-stream appointment. The appointment will be at the rank of Assistant Professor and will begin on July 1, 2019.   We are interested in candidates from psychology and statistical science whose research program advances both disciplines. We are particularly interested in scholars who demonstrate excellence in teaching and research, who transcend traditional statistical and psychology research topics, who complement our existing strengths (Psychology: home.psych.utoronto.ca; Statistical Sciences: http://utstat.toronto.edu/) and who are working on non-traditional areas at the cutting edge of both disciplines.   Applicants must have a Ph.D. in Psychology, Statistics, or a closely related field by the time of appointment or shortly thereafter. Excellence in research is evidenced primarily by the quality of published or forthcoming papers in top ranked and field-relevant academic journals, presentations at conferences, research awards and accolades, and strong endorsements by referees of top international stature. Evidence for excellence in teaching is based on strong letters of reference, teaching accomplishments and a teaching dossier containing a strong statement of teaching philosophy, teaching evaluations and sample syllabi.   The University of Toronto is an international leader in psychology and statistical science research and education. Successful candidates are expected to conduct independent, innovative research at the highest international level; to establish a strong externally funded independent research program; to demonstrate a strong commitment to undergraduate and graduate teaching, and to contribute to the enrichment of both Departments by leveraging the ample opportunities for collaboration. The successful candidate will join a vibrant intellectual community of world-class scholars at Canada’s leading university. The Greater Toronto Area offers amazing cultural and demographic diversity and one of the highest standards of living in the world.   Salary to be commensurate with qualifications and experience.   Applicants should apply online via AcademicJobsOnline, https://academicjobsonline.org/ajo/jobs/11765 and include a curriculum vitae, a cover letter, a list of publications, a research statement outlining their programmatic research approach, one sample publication, and a teaching dossier containing a strong statement of teaching philosophy, teaching evaluations and sample syllabi. Applicants should also arrange to have at least three strong letters of reference (on letterhead and signed) uploaded through AcademicJobsOnline directly by the writers. Review of applications will begin on October 20, 2018 and applicants should endeavor to have all materials submitted by then; however, applications will be accepted until the position is filled.   For more information about the Departments of Statistical Sciences and Psychology, please visit our websites at http://utstat.toronto.edu/ and home.psych.utoronto.ca. If you have questions about the position, please contact Katrina Mintis at katrina.mintis@utoronto.ca.    The University of Toronto is strongly committed to diversity within its community and especially welcomes applications from racialized persons / persons of colour, women, Indigenous / Aboriginal People of North America, persons with disabilities, LGBTQ persons, and others who may contribute to the further diversification of ideas.   All qualified candidates are encouraged to apply; however, Canadians and permanent residents will be given priority.  
								
								Applicants must have a Ph.D. in Psychology, Statistics, or a closely related field by the time of appointment or shortly thereafter. Excellence in research is evidenced primarily by the quality of published or forthcoming papers in top ranked and field-relevant academic journals, presentations at conferences, research awards and accolades, and strong endorsements by referees of top international stature. Evidence for excellence in teaching is based on strong letters of reference, teaching accomplishments and a teaching dossier containing a strong statement of teaching philosophy, teaching evaluations and sample syllabi. 
						
							
								Internal Number: STA/PSY 18#1 For more information please visit our website at: http://www.utstat.utoronto.ca/",2018-08-30,2019-07-01
ASA,Biostatistician Faculty Director,Rush University Medical Center,https://jobs.amstat.org/jobs/11430872/biostatistician-faculty-director,"Biostatistician Faculty Director Position  Rush University Medical Center Chicago, IL The Rush Institute for Healthy Aging at Rush University invites applications from candidates for tenure track faculty positions at the associate or full professor level to lead analytic and data management activities and staff in a thriving and growing multi-faceted research group with multiple community cohort studies, including epidemiologic studies and behavioral intervention and preventive trials. The successful candidate will also oversee an epidemiology and biostatistics staff for a university-wide core service and data network of the Chicagoland region. Candidates should preferably hold a doctoral degree in biostatistics.  The ideal candidate will have demonstrated excellence in research.  In addition, Rush University Medical Center has a strong and growing repository of clinical data that has been well organized and characterized, sourced from the Electronic Medical Record.  Candidates with an interest in use of Electronic Medical Record data for research are strongly encouraged to apply.   Interested applicants should submit CV and cover letter to:  Maggie McGauley Faculty Recruitment Maggie_McGauley@rush.edu   Rush is an Equal Opportunity Employer Rush University Medical Center is an academic medical center that encompasses a 669-bed hospital serving adults and children. In January 2012, Rush opened a new 376-bed hospital building, known as the Tower, which is part of the Medical Center’s major renovation of its campus. Rush University is home to one of the first medical colleges in the Midwest and one of the nation’s top-ranked nursing colleges, as well as graduate programs in allied health, health systems management and biomedical research. The Medical Center also offers more than 70 highly selective residency and fellowship programs in medical and surgical specialties and subspecialties.

Rush University Medical Center is consistently ranked as one of the nation’s top hospitals by U.S. News & World Report. Rush is ranked in 7 of 16 categories in U.S. News & World Report's 2018-2019 ""America's Best Hospitals"" issue, and is one of the two top-ranked hospitals in Illinois overall. Rush was one of four hospitals in the country that the American Hospital Association honored for equity of care in June of 2017. Rush was the first hospital in Illinois serving adults and children to receive Magnet status – the highest honor in n...ursing – and the first in Illinois to earn a fourth four-year designation. Rush has been ranked among the country's top 100 hospitals — and 15 major teaching hospitals — four times by Truven Health Analytics, a leading provider of health care data and analytics. Rush is located short distances from two other universities, two other medical centers, transportation centers, sports facilities, and residential/shopping neighborhoods.

Rush Hospitals receive Five Stars for Quality of Care - Read the article here!

Rush Is an Equal Opportunity Employer
			Show more
			Show less",2018-08-30,NA
ASA,Assistant Professor in Statistics,Swarthmore College,https://jobs.amstat.org/jobs/11424808/assistant-professor-in-statistics,"Description:  The Department of Mathematics and Statistics at Swarthmore College invites applications for a tenure track position as an Assistant Professor in Statistics beginning Fall 2019.  The department consists of 14 members: 3 statisticians and 11 mathematicians and is part of a small college with an all-undergraduate student population of 1600.  The teaching load for a tenure-track faculty starting in 2019 will be four courses a year.  It is often possible to teach multiple sections of the same course in a given semester.          
								
								Qualifications:  Applicants should have, or be close to obtaining, a Ph.D. in statistics.  They should also have a record of excellence in both scholarship and undergraduate teaching.  How to Apply:  Applications should include a cover letter that addresses how the applicant’s teaching and scholarship could thrive in and positively influence an undergraduate-only institution. Applications should also include a curriculum vitae, research statement, teaching statement, and three letters of recommendation, including at least one specifically commenting on teaching. Please submit all application materials to http://www.mathjobs.org. Only if this is not possible, send the materials to Stat Search Committee, Department of Mathematics and Statistics, Swarthmore College, 500 College Ave, Swarthmore, PA 19081-1390. Inquiries about the position may be sent to mathstatsearch@swarthmore.edu, which will be checked every few days throughout the search. Closing Date:  All completed applications received by October 15, 2018 will receive full consideration. Swarthmore College is a highly selective liberal arts college, located in the suburbs of Philadelphia, whose mission combines academic rigor with social responsibility.  Founded in 1864 by the Society of Friends, Swarthmore was one of the earliest coeducational colleges in the United States. Although it no longer has any religious affiliation, it still maintains close ties with Haverford and Bryn Mawr Colleges through a Tri-college consortium.  Swarthmore has a strong commitment to inclusive excellence through diversity in its educational program and employment practices. The College actively seeks and welcomes applications from candidates with exceptional qualifications, particularly those with demonstrable commitments to a more inclusive society, both within and outside the department.",2018-08-29,2018-10-15
ASA,Assistant Professor of Statistics,Mount Holyoke College,https://jobs.amstat.org/jobs/11420248/assistant-professor-of-statistics,"The Department of Mathematics and Statistics, which has offered a major in statistics for 30 years, invites applications for a tenure-track position in statistics at the Assistant Professor level to begin fall 2019. Qualifications include a doctorate (completed or anticipated), a commitment to teaching and scholarship in a liberal arts environment, and evidence of classroom effectiveness. We seek candidates who have an active interest in work with undergraduates on statistical research projects and who have a demonstrated record of strong teaching at the undergraduate level including experience mentoring students who are broadly diverse with regard to race, ethnicity, socioeconomic status, gender, nationality, sexual orientation, and religion. Candidates with backgrounds in Bayesian methods, computational statistics, spatial analysis, big data, or related areas are especially welcome. Members of the department are active in both research and curriculum development and teach two courses per semester. The Five Colleges cooperate actively in statistics, and statisticians meet together regularly.  Electronic submission of application materials through http://www.mathjobs.org is strongly preferred. A completed application should include a cover letter addressing your interest in Mount Holyoke College, a CV, and three statements concerning (1) teaching philosophy, (2) research interests, and (3) a statement about mentoring a diverse student body. Applicants should also arrange to have three letters of reference submitted on their behalf. At least one letter should comment specifically on your teaching. Though applications will be accepted until the position is filled, please submit by November 1, 2018 to receive full consideration. For further information about the department go to http://www.mtholyoke.edu/acad/math/. For further information you may contact the search chair, Andrea Foulkes (math-stat-chair@mtholyoke.edu). Mount Holyoke is an undergraduate liberal arts college for women with 2,200 students and 220 faculty. Over half the faculty are women; one-fourth are persons of color. Mount Holyoke College is located about 90 miles west of Boston in the Connecticut River valley, and is a member of the Five College Consortium consisting of Amherst, Hampshire, Mount Holyoke, and Smith Colleges and the University of Massachusetts. 

Mount Holyoke College is committed to enriching the educational experience it offers through the diversity of its faculty, administration, and staff members. Mount Holyoke seeks to recruit and support a broadly diverse faculty who will contribute to the college's academic excellence, diversity of viewpoints and experiences, and relevance in a global society. In furtherance of academic excellence, the College encourages applications from individuals from underrepresented groups in the professoriate, including faculty of color, faculty with diverse gender identities, first generation college students, individuals who have followed non-traditional pathways to college due to exceptional talent and motivation in the face of adversity, such as societal, economic or academic d...isadvantages, and individuals with a demonstrated commitment to applying and including diverse backgrounds and perspectives to learning, scholarship, service, and leadership in the academy.
			Show more
			Show less",2018-08-28,2018-11-01
