Source,Position,Faculty,Link,Description,PostingDate,DueDate
ASA,Assistant Professor of Statistics,North Carolina A&T State University,https://jobs.amstat.org/jobs/11543045/assistant-professor-of-statistics,"The Department of Mathematics at North Carolina A&T State University invites applications for a 9-month, tenure-track assistant or associate professorship in Statistics available in August 2019. The Department encourages persons from all areas of Statistics, Biostatistics, Advanced Data Analytics or Data Science to apply but is particularly interested in areas of statistical learning or machine learning, spatio-temporal data analysis, image and textual mining, data visualization, bioinformactics, multivariate statistics, high performance statistical computing or computational statistics. The Department of Mathematics seeks strong candidates with a Ph.D. in Statistics, Advanced Data Analytics, or Data Science to join a growing Department with interactive faculty.  Experience and track record indicating excellent potential to conduct research and advise students, and ability to teach statistics undergraduate and graduate courses are required. Other desirable attributes include excellent oral and written communication skills and the ability to interact with an interdisciplinary and collaborative intellectual community. The detailed posting of the position can be found at https://jobs.ncat.edu/postings/16191.  
								
								Requirements Applicants must have a Ph.D. in Statistics, Biostatistics or Data Science by the anticipated date of appointment, experience and track record indicating excellent potential to conduct research and advise students, and ability to teach undergraduate and graduate courses in the Department. Applications will be reviewed beginning December 1, 2018, and the review will continue until the position is filled. Interested applicants must submit the following items via the job posting at https://jobs.ncat.edu/postings/16191: 1) electronic application for employment (resumes will not be accepted in lien of completing an electronic application); 2) letter of interest (cover letter); 3) current curriculum vitae; 4) legible copies of all undergraduate and graduate transcripts (upload a copy of each transcript under the degree name; original transcripts will be required if hired); 5) statement of teaching philosophy; and 6) statement of research interests and accomplishments.  Skills/Education: The position is open to any area of statistics, Advanced Data Analytics or Data Science with preference given to those whose research expertise and interests lie in the areas of statistical or machine learning, spatio-temporal data analysis, image and textual mining, data visualization, bioinformactics, multivariate statistics, high performance statistical computing or computational statistics. For the position of assistant professor, applicants must show strong research potential and commitment to excellence in teaching, learning and student success. Research productivity beyond the doctoral dissertation is expected. For an associate professorship, applicants should show evidence of excellence in teaching, learning and student success, and have an established research reputation, including success in securing extramural funding, record of publications and supervision of graduate students. Postdoctoral research experience or equivalent industrial experience is desirable. University teaching experience is a plus. 
						
							
								Internal Number: Position 1554 North Carolina A & T State University is a public, doctoral/high research and 1890 land-grant
university that enrolls nearly 11,900 students. The Department of Mathematics is an academic
unit within the College of Science and Technology, seeking to provide undergraduate and
graduate students with an inviting environment that inspires them to become leaders in their
fields and areas of expertise. The Department of Mathematics offers degree programs in Pure
Mathematics, Applied Mathematics, Statistics, and Mathematics Education at the B.S. level,
Applied Mathematics at the M.S. level, as well as Master of Arts in Teaching Mathematics. The
Mathematics faculty have a strong involvement with two interdisciplinary doctoral programs:
Energy and Environmental Systems Ph.D. program, and Computational Science and
Engineering Ph.D. program. The Department of Mathematics enrolled over 70 undergraduate
majors and 21 master’s students in fall 2017 and currently has 23 tenured or tenure-track faculty
and 4 full-time non-tenure-track faculty. In the 2016-2017 academic year, the Department
graduated 8 undergraduate students and 11 master’s students. In terms of student credit hours
tau...ght, it is, as befits a STEM oriented university, the largest department in the College of
Science and Technology.
			Show more
			Show less",2018-10-04,2019-08-20
ASA,Decision Scientist,"Facebook, Inc.",https://jobs.amstat.org/jobs/11547338/decision-scientist,"Help build the next generation of systems behind Facebook's products. Facebook, Inc. currently has multiple openings in Menlo Park, CA (various levels/types): Decision Scientist (134973J) Partner with marketing, research and product organizations to design, execute, measure and improve the impact of marketing efforts. Mail resume to: Facebook, Inc. Attn: AA-USIM, 1 Hacker Way, Menlo Park, CA 94025. Must reference job title & job code shown above, when applying.  
								
								 
						
							
								Internal Number: 134973J ",2018-10-04,NA
ASA,Research Analyst,"Cubist Systematic Strategies, LLC",https://jobs.amstat.org/jobs/11547434/research-analyst,"Cubist Systematic Strategies, LLC seeks Research Analyst – NY, NY. Design, backtest & implement predictive models for direction & volatility of liquid futures, FX & ETFs and algorithms for optimal portfolio construction across options & delta one products.  Compute Implied Volatility surfaces.  Risk Model (including option Greeks).  Perform liquidity & transaction cost modeling.  Evaluate new datasets for alpha potential. At least Ph.D. or equiv. in Financial Eng., Stat., Eng., Ops Res., Math. or rltd quant. fld & at least 2 yrs as Research/Financial Analyst.  Also 2 yrs w: developing, researching & implementing quantitative models on behalf of a financial service institution; large-scale portfolio optimization, multi-period optimization & relevant software libraries & packages; performing stat. analysis of historical data from markets to build quant. models; analyzing  risk & return profile of portfolios of financial instruments; conducting independent research utilizing large data sets; systematic trading research; programming in Python; & macro asset classes such as fixed incomes/commodities & currencies. Resume to Recruiting2014@Point72.com; Job Code XL102018  
								
								 
						
							
								Internal Number: 67586 ",2018-10-04,NA
ASA,"Chair, Department of Biostatistics & Medical Informatics",University of Wisconsin-School of Medicine and Public Health,https://jobs.amstat.org/jobs/11547322/chair-department-of-biostatistics-medical-informatics,"We seek a recognized leader with proven leadership and management skills as well as an outstanding academic background. The chair will provide strategic and administrative leadership of the highest quality to this distinguished department in its teaching, research and service missions.The School of Medicine and Public Health has a deep and profound commitment to diversity both as an end in itself but also as a valuable means for eliminating health disparities. As such, we strongly encourage applications from candidates who foster and promote the values of diversity and inclusion.  
								
								DEGREE AND AREA OF SPECIALIZATION: Ph.D., M.D., MD/Ph.D. or equivalent. MINIMUM NUMBER OF YEARS AND TYPE OF RELEVANT WORK EXPERIENCE: Substantial background and experience in administrative leadership, teaching and research, including training programs for the full continuum of Biostatistics and Medical Informatics learners, and a strong academic background that would qualify for appointment as a tenured professor at the University of Wisconsin-Madison. LICENSE OR CERTIFICATE: Not required. 
						
							
								Internal Number: 96127-FA From creating academic programs targeting health professional shortage areas to becoming the nation's first school to integrate medicine and public health, the University of Wisconsin consistently strives to be on the forefront of health care innovation through service, science, scholarship and social responsibility. See why we're consistently recognized as an international leader in education, research and service.",2018-10-04,NA
