Source,Position,Faculty,Link,Description,PostingDate,DueDate
ASA,Remote Principal/  Senior Biostatistician,MMS,https://jobs.amstat.org/jobs/11489919/remote-principal-senior-biostatistician,"MMS is a global CRO, that focuses on regulatory submission support for the pharmaceutical, biotech and medical device industries. We are a pharmaceutical service provider supporting pharmaceutical and biotech industries with medical writing, biostatistics, clinical programming, data management, clinical development, regulatory affairs, regulatory submissions and pharmacovigilance. Job Description Provides advanced input into statistical sections and overall consistency of clinical study protocols. Develops and reviews statistical analysis plans (SAP). Determines appropriate analyses for clinical endpoints based on input from the protocol and the client. Performs senior-level reviews and is responsible for the datasets and outputs of a project. Ensures consistency with the SAP and reviews for correctness and quality. Works with programming team to provide definitions for analysis/ADaM datasets to be used for final analyses. Develops specifications and reviews datasets based on what is needed for the planned tables, listings and graphs (TLGs). Prepares TLG shells/specifications and programming notes based on SAP and analysis/ADaM datasets. Works with data management team to review data collection (e.g., CRFs) and helps ensure data quality throughout the clinical trial. Performs and/or coordinates the preparation, execution, reporting and documentation of high-quality statistical analysis according to the SAP. Responsible for the statistical considerations in FDA submissions for Integrated Summary of Safety (ISS) and Integrated Summary of Efficacy (ISE), including but not limited to ISS/ISE SAP, data integration plan and oversight of all integrated analyses. Provides high level of support to the programmers and medical writers on all statistical matters according to client requirements. Prepares and reviews statistical methods and results sections for the clinical study report (CSR) with in-house medical writers. Provides support to Data Safety Monitoring Boards (DSMB) by preparing and presenting output as the unblinded statistician. Generates sample size calculations appropriate for the primary endpoint and based on input from the protocol. Generates and reviews randomization schedules per the protocol and randomization specifications. Works with the project management group to ensure timelines are appropriate given the scope of the project. Is familiar with and stays current with the latest industry practices and updated regulatory guidelines. Communicates competently and independently with client to coordinate the statistical and programming considerations of the project.  
								
								Master of Science (in statistics of equivalent) with four (4) plus years relevant work experience or PhD (in statistics of equivalent) with two (2) plus years of relevant years of work experience. Strong knowledge of and experience with SAS (SAS Stat, SAS Base, SAS macros, SAS/ODS, SAS/Graph). Able to be in a hands-on role by digging into data and using SAS to validate datasets and outputs. Excellent mathematical and problem solving skills. Advanced knowledge of the statistical considerations involved in drug development including hands-on experience with clinical trial data. Strong knowledge of study designs and statistical analysis methods (e.g., GLMs, non-parametric methods, survival analysis techniques, general imputation methods, common descriptive stats). Strong familiarity with a variety of clinical data and databases (including EDC systems) Working knowledge of SDTM/ADaM standards (in the absence of ADaM experience, considerable experience working with analysis or derived datasets). At least three (3) years of experience in pharmaceutical industry. Ability to coordinate the analytical aspects of multiple projects or clinical trials at the same time. Proficiency with MS Office applications (e.g., Word, PowerPoint and Excel). Good interpersonal, oral, and written communication skills. Self-motivated, hardworking, dependable, and positive team-oriented personality. Ability to communicate effectively and provide clear directions to Statistical Programmers. 
						
		
			NOTES:
			
				6 openings.Additional Salary Information: We offer competitive salary and benefits packages. Our mission is to deliver high-quality services, rooted in good science and decades of regulatory experience, that will assist our clients in developing and marketing life-changing therapies, thereby positively affecting patients' lives worldwide.",2018-09-18,NA
ASA,Tenure-Track Assistant Professor in Statistics at Kansas State University,Kansas State University,https://jobs.amstat.org/jobs/11486560/tenure-track-assistant-professor-in-statistics-at-kansas-state-university,"The Department of Statistics at Kansas State University seeks to hire a tenure-track Assistant Professor beginning Fall, 2019. Responsibilities include building a strong research program in Statistics and/or Data Science that may include interdisciplinary research, teaching and developing undergraduate and graduate courses in statistics, advising undergraduate research projects, mentoring MS and PhD students in Statistics, and serving on departmental or college committees. Candidates conducting research in all areas of Statistics and/or Data Science will be given full consideration. Those with a demonstrated research expertise in statistical education, computational statistics or data science are especially encouraged to apply. The Department was founded in 1959 and offers BS, MS, and PhD degrees. It has 15 full-time faculty members with research interests covering a wide range of topics in both theory and applications. The department encourages and values interdisciplinary research and collaboration with faculty in biology, the engineering and physical sciences, veterinary medicine, animal science, nutrition and kinesiology, agricultural sciences and other departments across campus. These research opportunities are also enhanced by the existence of multi-disciplinary research institutes and centers, such as the Institute of Computational Comparative Medicine, the Nanotechnology Innovation Center, the Ecological Genomics Institute, the Kansas Lipidomics Research Center, the Konza Prairie Biological Station and K-State Research and Extension. Additional university initiatives include the Global Food Systems and Big Data. It is also worth to mention that the National Bio and Agro-defense Facility (or NBAF), the United States' foremost animal disease research facility, will be operational in Manhattan, KS by 2022-2023. Currently, there are about 70 graduate students, about two thirds of whom are working toward a PhD in Statistics. The majority of graduate students are supported with teaching or research assistantships. For more information about the Department of Statistics, please see www.ksu.edu/stats.  
								
								Minimum requirement: A Ph.D. in Statistics or a closely related field by the start of employment. Preferred qualifications: 1) outstanding research potential in Statistics and/or Data Science, a potential for excellence in teaching advanced undergraduate and graduate level statistics courses, and excellent communication skills; 2) the ability or demonstrated strong potential to mentor PhD students. Please submit all required documents listed below for full consideration: 1) Cover letter (describing the applicant’s background and interests as they relate to our preferred qualities given above); 2) Research statement; 3) Teaching statement; 4) A detailed curriculum vitae; 5) Transcripts of graduate level coursework; 6) Three letters of reference; 7) (Optional) A sample of written scholarly work. All materials and letters of reference must be submitted electronically via Human Capital Services website, http://careers.k-state.edu/cw/en-us/job/504733/assistant-professor-statistics. Please fill in the contact information of reference writers while working on the online application. The referees will be directly contacted through email with instructions for uploading their letters. Review of applications will begin November 15, 2018 and continue until position is filled. Questions can be directed to Dr. Wei-Wen Hsu, search committee chair, at wwhsu@ksu.edu. 
						
		
			NOTES:
			
				Additional Salary Information: KSU is EOE of individuals with disabilities and protected veterans and actively seeks diversity among its employees. Background check required. Kansas State University has approximately 21,400 students from all 50 states and 90 countries. The
University is located in Manhattan, Kansas. The “Little Apple” is a classic college town with a zoo, 21
parks, and a recreation trail that circles the city. Manhattan is also home to exciting Big XII sports,
excellent restaurants, and outdoor recreation. Located in the Flint Hills of Kansas and edging the Kansas
River, Manhattan is situated 9 miles north of Interstate 70, 125 miles west of Kansas City.",2018-09-17,2018-11-15
ASA,"Assistant Professor of Applied Statistics and Operations Research, Bowling Green State University",Bowling Green State University,https://jobs.amstat.org/jobs/11486630/assistant-professor-of-applied-statistics-and-operations-research-bowling-green-state-university,"Two tenure-track full-time faculty positions available August, 2019. Responsibilities: Undergraduate and Graduate Teaching, Research in Applied Statistics or related fields. Minimum qualification: Ph.D. in Statistics, Data Science, Computer Science, Industrial Engineering, Operations Research, or a closely related field.  ABD with degree completion by August, 2020 will be accepted. For a complete job description and instructions on how to apply for this position visit https://bgsu.hiretouch.com/ or contact the Office of Human Resources, BGSU. Application deadline is October 29, 2018. Background check required for employment. BGSU is an AA/EEO/Vet employer. We encourage applications from women, minorities, veterans, and persons with disabilities regardless of age, gender identity, genetic information, religion, or sexual orientation.  
								
								 
						
		
			NOTES:
			
				Additional Salary Information: Competitive and commensurate with peer institution levels for rank and position in keeping with candidate’s experience and credentials.  Full benefits package available. Bowling Green State University is a tier-one, public university serving 19,000 students on two campuses in northwest Ohio. The University has nationally recognized programs and research in the natural and social sciences, education, arts, business, health and wellness, humanities and applied technologies. BGSU seeks talented individuals to join our community in Bowling Green, Ohio, recognized as one of the “Best College Towns of America.” Bowling Green State University provides experiences that enhance lives. Students are prepared for lifelong career growth, lives of engaged citizenship and leadership in a global society. U.S. News and World Report names BGSU as one of the top public universities nationwide with a strong commitment to first-year programs that lead to success. Within our transformative learning community, we build a welcoming, safe and diverse environment where the creative ideas and achievements of all can benefit others throughout Ohio, the nation and the world.",2018-09-17,2019-08-20
ASA,UCLA Statistics Faculty Searches,UCLA Statistics,https://jobs.amstat.org/jobs/11479620/ucla-statistics-faculty-searches,"Open-ranked faculty position (tenured or tenure track) and Assistant Professor faculty position (tenure track) in the Department of Statistics at the University of California, Los Angeles. We seek outstanding applicants contributing to the cutting edge development of theoretical statistics, general statistical methodology or computational statistics.   We welcome applicants whose experience in research, teaching and service have prepared them to contribute to UCLA’s commitment to excellence and diversity. Ph.D. or Ph.D. candidates in Statistics (or a closely related field) are welcomed to apply. Degree required at time of appointment. Salary will be commensurate with education and experience.   Reviews for the position will commence on October 15, 2018 and will continue until a successful candidate is identified. Interested applicants should apply at UCLA Academic Recruit at:   Open-Ranked Professor https://recruit.apo.ucla.edu/apply/JPF03899   Assistant Professor https://recruit.apo.ucla.edu/apply/JPF03901   Please refer to job tracking number JPF03899 or JPF03901 on all correspondence.   The University of California is an Equal Opportunity/Affirmative Action Employer. All qualified applicants will receive consideration for employment without regard to race, color, religion, sex, sexual orientation, gender identity, national origin, disability, age or protected veteran status. For the complete University of California nondiscrimination and affirmative action policy see: UC Nondiscrimination & Affirmative Action Policy at   http://policy.ucop.edu/doc/4000376/NondiscrimAffirmAct   Applicants should submit:   1) CV 2) Cover Letter describing how their qualifications and interests would fit with the position description 3) Three representative publications (or manuscripts) 4) Statement of Research 5) Statement of Teaching 6) Statement of Contributions to Equity, Diversity, and Inclusion 7) Three letters of recommendation (JPF03899 - optional but strongly encouraged; JPF03901 - mandatory)   The Statement of Contributions to Equity, Diversity, and Inclusion briefly addresses past and/or potential contributions to diversity through research, teaching, and/or service.   All inquiries may be sent to Chie Ryu at chie.ryu@stat.ucla.edu.  
								
								Ph.D. or Ph.D. candidates in Statistics (or a closely related field) are welcomed to apply. Degree required at time of appointment. 
						
		
			NOTES:
			
				2 openings.Employer will assist with relocation costs.
		
	
							
								Internal Number: JPF03899 / JPF03901 University of California, Los Angeles (UCLA).
Department of Statistics.",2018-09-14,2018-10-15
ASA,Assistant Professorships of Statistics,Middlebury College,https://jobs.amstat.org/jobs/11479711/assistant-professorships-of-statistics,"Assistant Professorships of Statistics  The Department of Mathematics invites applications for two tenure-track Assistant Professorships in Statistics to begin in fall 2019. A PhD in statistics or a closely related field should normally be in hand by time of appointment. Successful candidates will advise, mentor, teach courses at all levels including the first-year seminar program, and contribute to crafting the expansion of our statistics and data science offerings. The potential to collaborate across disciplines and/or incorporate undergraduates in research is desirable. Middlebury College is a top-tier liberal arts college with a demonstrated commitment to excellence in faculty teaching and research. An Equal Opportunity Employer, the College is committed to hiring a diverse faculty as we work to foster innovation in our curriculum and to provide a rich and varied educational experience for our increasingly diverse student body. EOE/Minorities/Females/Vet/Disability. Applications should be submitted via Interfolio at http://apply.interfolio.com/52300. Please submit: a letter of application; a teaching statement that includes your vision for statistics education in a liberal arts setting; a description of your research program; curriculum vitae; graduate transcript; and three letters of recommendation, at least two of which speak to teaching ability. At Middlebury, we strive to make our campus a respectful, engaged community that embraces difference, with all the complexity and individuality each person brings. In your application materials please be sure to address how your teaching, scholarship, mentorship and/or community service might support our commitment to diversity and inclusion. Questions about the application process or the position can be directed to Steve Abbott at abbott@middlebury.edu. Review of applications will begin on October 15 and continue until the positions are filled. Offers of employment are contingent on completion of a background check. Information on our background check policy can be found at http://go.middlebury.edu/backgroundchecks.Copyright ©2017 Jobelephant.com Inc. All rights reserved.Posted by the FREE value-added recruitment advertising agency  jeid-c01034ca40f36f4082d83bf46809d7b8  
								
								 
						
							
								Internal Number: 1294077 ",2018-09-14,NA
ASA,Assistant Professor in Statistics or Probability,Stanford University Statistics Department,https://jobs.amstat.org/jobs/11479674/assistant-professor-in-statistics-or-probability,"The Statistics Department at Stanford University invites applications for a tenure-track Assistant Professor position in Applied Statistics, Theoretical Statistics, or Probability. This is a research and teaching position with student advising and department committee responsibilities. Applicants should have demonstrated strong research abilities. A Ph.D. in Statistics or a related area is required. Applicants should submit a letter of application, curriculum vita, a statement of research and teaching interests, graduate transcripts, not more than one preprint/reprint, and arrange for three letters of recommendation to be submitted. Applications and letters should be submitted online at https://academicjobsonline.org/ajo/jobs/11504. Questions may be submitted to search@stat.stanford.edu. Evaluation of applicants will begin November 16, 2018. Applications must be received by December 11, 2018 to be guaranteed consideration. The Stanford Statistics department currently has 22 regular faculty members, as well as a distinguished group of emeriti. Many professors have joint appointments in other departments, including positions in mathematics, economics, the School of Medicine, the School of Engineering, and the School of Education. The varied research in the department integrates core statistical theory, mathematics, computing, algorithms, and applications to many scientific disciplines. More information on the department can be found on its website: https://statistics.stanford.edu. Stanford is an equal employment opportunity and affirmative action employer. All qualified applicants will receive consideration for employment without regard to race, color, religion, sex, sexual orientation, gender identity, national origin, disability, protected veteran status, or any other characteristic protected by law. Stanford also welcomes applications from others who would bring additional dimensions to the University’s research, teaching and clinical missions. Statistics has been taught at Stanford since 1924 when Harold Hotelling joined the university. The program became a full department at Stanford in 1948 and we moved into our new building in February 1998, our 50th anniversary. During this time the department has evolved into a preeminent center for statistical research, top-ranked in the United States,  and our doctoral program is ranked number one by the latest US National Research Council rankings.The department's goal is research and student training in statistical methodology and in probability, and the department has historically also been very active in the development of these methodologies to advance other fields in the sciences and in medicine. There are currently 20 faculty in the department that train about 50 PhD students and 40 Master students. The department also administers an interdepartmental undergraduate major in Mathematical and Computational Science. This program has been ahead of its time by recognizing the importance of computing in the coming age of big data. Starting in Autumn of 2013, the program is complemented at the graduate level with a Data Science track in our master program.",2018-09-14,2018-11-16
ASA,Professor - Statistics (Tenured),University of Illinois at Chicago - MSCS,https://jobs.amstat.org/jobs/11480088/professor-statistics-tenured,"University of Illinois at Chicago College of Liberal Arts and Sciences Department of Mathematics, Statistics, and Computer Science TransUnion Professor   The Department of Mathematics, Statistics, and Computer Science seeks to recruit an exceptional statistician for a newly established TransUnion Professorship. This position has been created in part by a generous endowment from TransUnion. The successful candidate will have a strong academic background, an outstanding research record, excellent leadership skills and strong teaching ability.  The TransUnion Professor will play a central role in developing multidisciplinary research programs and curricular initiatives in Data Science at UIC.  Applicants must have a Ph.D. or equivalent degree in statistics, data science or a related field.  The position is effective August 16, 2019.    Located in the heart of one of the world’s great cities, the University of Illinois at Chicago is the city’s only public research university with 30,000 students, 15 colleges, a hospital and a health sciences system. Researchers across several colleges are active in foundational research in data science as well as its applications. The Department of Mathematics, Statistics, and Computer Science has active research programs in a broad spectrum of centrally important areas of pure mathematics, computational and applied mathematics, mathematical computer science, probability and statistics, and mathematics education.  See http://www.math.uic.edu for more information.  
								
								Applicants should provide a vita, research and teaching statements, and at least three (3) letters of recommendation.  Applications should be submitted through mathjobs.org.   No applications will be accepted by surface mail or e-mail.  To ensure full consideration, application materials must be received by October 24, 2018, but applications will be accepted through November 30, 2018.   The University of Illinois at Chicago is an affirmative action, equal opportunity employer, dedicated to the goal of building a culturally diverse and pluralistic faculty and staff committed to teaching and working in a multicultural environment. We strongly encourage applications from women, minorities, individuals with disabilities and covered veterans. The University of Illinois may conduct background checks on all job candidates upon acceptance of a contingent offer. Background checks will be performed in compliance with the Fair Credit Reporting Act. The Department has active research programs in a broad spectrum of centrally important areas of pure mathematics, computational and applied mathematics, mathematical computer science, probability and statistics, and mathematics education.  See http://www.math.uic.edu for more information.",2018-09-14,2019-08-16
